{
  "$id": "gts://gts.x.core.events.type.v1~",
  "$schema": "http://json-schema.org/draft-07/schema#",
  "x-gts-abstract": true,
  "title": "Event Envelope (Common Fields)",
  "type": "object",
  "description": "Abstract base event type definition. Instances must use a concrete derived type.",
  "required": [
    "id",
    "type",
    "tenantId",
    "occurredAt"
  ],
  "x-gts-traits-schema": {
    "type": "object",
    "additionalProperties": false,
    "properties": {
      "topicRef": {
        "description": "GTS ID of the topic/stream where events of this type are published.",
        "type": "string",
        "x-gts-ref": "gts.x.core.events.topic.v1~",
        "default": "gts.x.core.events.topic.v1~x.core._.default.v1"
      },
      "retention": {
        "description": "ISO 8601 duration for event retention.",
        "type": "string",
        "default": "P30D"
      }
    }
  },
  "properties": {
    "type": {
      "description": "Identifier of the event type in GTS format.",
      "type": "string",
      "x-gts-ref": "/$id"
    },
    "$schema": {
      "description": "Link to the event type schema.",
      "type": "string"
    },
    "id": {
      "type": "string",
      "format": "uuid"
    },
    "tenantId": {
      "type": "string",
      "format": "uuid",
      "description": "The id of the tenant that produced the event. Mandatory"
    },
    "userId": {
      "type": "string",
      "format": "uuid",
      "description": "The id of the user that produced the event. Optional"
    },
    "clientId": {
      "type": "string",
      "format": "uuid",
      "description": "The id of the API client that produced the event. Optional"
    },
    "source": {
      "description": "Full SemVer of the event type schema used to produce this event.",
      "type": "string",
      "maxLength": 256
    },
    "occurredAt": {
      "type": "string",
      "format": "date-time",
      "description": "The time the event occurred. Fully controlled by the producer"
    },
    "ingestedAt": {
      "type": "string",
      "format": "date-time",
      "description": "The time the event was ingested into the event store.",
      "readOnly": true
    },
    "sequenceNumber": {
      "type": "number",
      "description": "The sequence number of the event in the stream."
    },
    "previousSequenceNumber": {
      "type": "number",
      "description": "The sequence number of the previous event in the same stream."
    },
    "payload": {
      "description": "Type-specific body; see event type schema.",
      "type": "object"
    },
    "subject": {
      "description": "The subject of the event.",
      "type": "string"
    },
    "subjectType": {
      "description": "GTS type of the subject of the event.",
      "type": "string",
      "x-gts-ref": "gts.*",
      "$comment": "The value is mandatory if subject is present"
    }
  },
  "additionalProperties": false
}
